{
  "schema_version": "5.1",
  "kind": "assets",
  "lineage": {
    "story": "211e23b920965167258557b3d7585a8c9055a0eeb23d5d34b18b033a1a6a71cb",
    "cast": "9f627d3001c6602d4552f6a1b1a16bc6780d51b40d889df9f760fc78bdafc606"
  },
  "assets": [
    {
      "asset_id": "CHAR_A_H3_OFFICE",
      "file": "CHAR_A_H3_OFFICE.png",
      "role": "H3_RUNTIME",
      "character_id": "CHAR_A",
      "wardrobe": "OFFICE",
      "direct_bindable": true,
      "description": {
        "cn": "顾言川的身份与黑色通勤西装",
        "en": "Gu Yanchuan's identity and black office suit"
      },
      "dependency_metadata_origin": "LEGACY_UNVERIFIED",
      "version": null,
      "derived_from": [],
      "source_versions": {},
      "generated_from_version": {},
      "status": "UNVERIFIED"
    },
    {
      "asset_id": "CHAR_B_H3_OFFICE",
      "file": "CHAR_B_H3_OFFICE.png",
      "role": "H3_RUNTIME",
      "character_id": "CHAR_B",
      "wardrobe": "OFFICE",
      "direct_bindable": true,
      "description": {
        "cn": "林晚晴的身份与黑色通勤西装",
        "en": "Lin Wanqing's identity and black office suit"
      },
      "dependency_metadata_origin": "LEGACY_UNVERIFIED",
      "version": null,
      "derived_from": [],
      "source_versions": {},
      "generated_from_version": {},
      "status": "UNVERIFIED"
    },
    {
      "asset_id": "CHAR_C_H3_OFFICE",
      "file": "CHAR_C_H3_OFFICE.png",
      "role": "H3_RUNTIME",
      "character_id": "CHAR_C",
      "wardrobe": "OFFICE",
      "direct_bindable": true,
      "description": {
        "cn": "陈悦的身份与黑色通勤西装",
        "en": "Chen Yue's identity and black office suit"
      },
      "dependency_metadata_origin": "LEGACY_UNVERIFIED",
      "version": null,
      "derived_from": [],
      "source_versions": {},
      "generated_from_version": {},
      "status": "UNVERIFIED"
    },
    {
      "asset_id": "CHAR_D_H3_OFFICE",
      "file": "CHAR_D_H3_OFFICE.png",
      "role": "H3_RUNTIME",
      "character_id": "CHAR_D",
      "wardrobe": "OFFICE",
      "direct_bindable": true,
      "description": {
        "cn": "周明的身份与黑色通勤西装",
        "en": "Zhou Ming's identity and black office suit"
      },
      "dependency_metadata_origin": "LEGACY_UNVERIFIED",
      "version": null,
      "derived_from": [],
      "source_versions": {},
      "generated_from_version": {},
      "status": "UNVERIFIED"
    },
    {
      "asset_id": "SCN_LIVING_MASTER",
      "file": "SCN_LIVING_MASTER.png",
      "role": "MASTER",
      "scene_id": "SCN_LIVING_NIGHT",
      "scene_family_id": "LIVING",
      "direct_bindable": true,
      "description": {
        "cn": "客厅建筑、门窗、沙发、茶几及固定空间几何",
        "en": "the living-room architecture, doors, windows, sofa, coffee table, and fixed spatial geometry"
      },
      "dependency_metadata_origin": "LEGACY_UNVERIFIED",
      "version": null,
      "derived_from": [],
      "source_versions": {},
      "generated_from_version": {},
      "status": "UNVERIFIED"
    }
  ]
}
